Id Sql,Id,Centres,Bloc,Nom Curt,Nom Programa,Descripcio,Ambits Curriculars,Ambits Innovacio,Etapes Objectiu,Objectius,Requisits,Compromisos,Periode,Fitxa,Enllaç Fitxa,Vídeo,Web Programa,Simbol,Unitat,Responsable,Contacte,Modificar Definicio,Pujar Dades,Continuitat Anual,Idfullnouscentres,Dades Json
15,55,55,Programes,avancem,Avancem: aprenentatge integrat de les llengües,El programa _Avancem_ promou un ensenyament i aprenentatge de les llengües competencial i de caràcter integrador. La durada del programa per als centres que hi participen és de tres cursos escolars. ,LIN,"A1-MET,A2-ORG","BATX,EPRI,ESO","- Millorar la competència comunicativa de l’alumnat a través d’un ensenyament integrat de les llengües i com a estratègia bàsica per a la implementació d’una educació plurilingüe.
- Potenciar la curiositat lingüística i cultural de l’alumnat i fomentar ac","Per formar part del programa els centres educatius han de presentar la sol·licitud de participació i complir els requisits següents:
- Disposar d’un projecte educatiu de centre amb objectius adreçats a promoure una educació plurilingüe i intercultural, qu","La participació del centre en el programa suposa l’acceptació dels compromisos següents:
- Constituir un grup impulsor en el centre, del qual formaran part el director/a o un membre de l’equip directiu en qui delegui, el coordinador/a lingüístic/a i un/a ",Trianual,03_Avancem.pdf,https://clic.xtec.cat/pub/innovacio/fitxes/03_avancem.pdf,https://www.youtube.com/watch?v=zStOdtFCX4E&list=PLHQ2RmbOIhEqjjKbhH-LTt_QgyUdD6IYY&index=3,https://projectes.xtec.cat/avancem/el-projecte/,avancem.png,,,"sllengua@xtec.cat,mblanch3@xtec.cat,nverges1@xtec.cat",S,S,,1K371xgiXyDoc7Ec4dZ0OtRQm52l2AfmCahOQuMyv9iQ,"{""id"": ""55"", ""Bloc"": ""Programes"", ""Fitxa"": ""03_Avancem.pdf"", ""Enllac"": ""https://projectes.xtec.cat/avancem/el-projecte/"", ""Simbol"": ""avancem.png"", ""Unitat"": """", ""Vídeo"": ""https://www.youtube.com/watch?v=zStOdtFCX4E&list=PLHQ2RmbOIhEqjjKbhH-LTt_QgyUdD6IYY&i"
16,56,56,Programes,talentcreatiu,Talent creatiu i empresa,"El programa _Talent creatiu i empresa_ consisteix en el foment i la realització de projectes que desenvolupin estratègies de relació en el camp de la innovació i l&apos;intercanvi de coneixement entre els centres docents d’arts plàstiques i disseny, les em",ART,"A1-MET,A3-COM","RESP,CFAM,CFAS","Els objectius específics del programa són:&#10;- Definir i desenvolupar estratègies de relació en el camp de la innovació i intercanvi de coneixement entre els centres docents i les empreses, institucions i entitats.&#10;- Establir xarxes de centres educat",Poden formar part del programa els centres educatius de Catalunya sostinguts amb fons públics i els centres de titularitat privada que reuneixin com a mínim els requisits següents:&#10;- Tenir implantats o autoritzats els ensenyaments professionals d’arts ,La participació del centre en el programa suposa l’acceptació dels compromisos següents:&#10;- Implicació de l’equip docent en la participació en el programa durant la seva vigència.&#10;- Designar una persona coordinadora del projecte en el centre i les p,Anual,14_Talent creatiu.pdf,https://clic.xtec.cat/pub/innovacio/fitxes/14_talent creatiu.pdf,,https://xtec.gencat.cat/ca/curriculum/professionals/artistics/artsplastdis/innovacio/talent-creatiu-i-empresa,talent_creatiu.png,,,artsidisseny.ensenyament@gencat.cat,,S,S,1m0hCD6tolApYmkYGiLpY88D8qSsxyy_-DZYmQd_LXC8,"{""id"": ""56"", ""Bloc"": ""Programes"", ""Fitxa"": ""14_Talent creatiu.pdf"", ""Enllac"": ""https://xtec.gencat.cat/ca/curriculum/professionals/artistics/artsplastdis/innovacio/talent-creatiu-i-empresa"", ""Simbol"": ""talent_creatiu.png"", ""Unitat"": """", ""Vídeo"": """", ""Centr"
17,57,57,Programes,tecnologiesdigitals,Programa d'innovació de Tecnologies Digitals per a l'Aprenentatge&quot;,El programa _Tecnologies Digitals per a l’Aprenentatge_ consisteix en la promoció de l’equitat i la qualitat del sistema educatiu reflectida en la millora de les capacitats i competències de l’alumnat participant per mitjà diferents àmbits de participació:,"CIE,DIG","A1-MET,A2-ORG,A3-COM","EINF2C,EPRI,ESO,BATX,CFPM,CFPS,CFAS,ADULTS,EE,IDI",- Promoure la innovació educativa basada en l’ús efectiu de les tecnologies digitals per contribuir a enriquir i potenciar el conjunt dels aprenentatges curriculars.&#10;- Facilitar el desplegament de les competències digitals.&#10;- Fomentar la inclusió e,"Per formar part del programa els centres educatius han de presentar la sol·licitud de participació i complir els requisits següents:&#10;&#10;**De caràcter general:**&#10;- Impartir un d’aquests ensenyaments: educació infantil, educació primària, educació ",De caràcter general per a tots els àmbits de participació:&#10;- Implementar alguna de les línies de treball del programa Tecnologies Digitals per a l’Aprenentatge adaptant-les a les característiques del centre i publicar els continguts produïts pels alumn,Trianual,05_Tecnologies Digitals.pdf,https://clic.xtec.cat/pub/innovacio/fitxes/05_tecnologies digitals.pdf,https://www.youtube.com/watch?v=Eu-TqNLn3tE&list=PLHQ2RmbOIhEqjjKbhH-LTt_QgyUdD6IYY&index=11,https://projectes.xtec.cat/xarxadults/iniciatives-pedagogiques/programes/tecnologies-digitals-per-a-laprenentatge/,tda.png,,,innovaciotac@xtec.cat,,S,,1ddmqcZOgHMPEnHrXhHcEvvIfxYS_fm4dXx26lVPnQPw,"{""id"": ""57"", ""Bloc"": ""Programes"", ""Fitxa"": ""05_Tecnologies Digitals.pdf"", ""Enllac"": ""https://projectes.xtec.cat/xarxadults/iniciatives-pedagogiques/programes/tecnologies-digitals-per-a-laprenentatge/"", ""Simbol"": ""tda.png"", ""Unitat"": """", ""Vídeo"": ""https://w"
18,59,59,Programes,apadrinem,Apadrinem el nostre patrimoni,"Aquest programa es basa en la idea de l’apadrinament d’un element patrimonial per part del centre educatiu, la qual cosa comporta donar-li valor i aprofundir en el seu coneixement des del punt de vista cultural i, alhora, fer que aquest coneixement sigui s","LIN,CME,SOC,PSO,EVA,CVA,DIG","A1-MET,A3-COM","EINF2C,EPRI,ESO,BATX,CFPM,CFPS,ADULTS, EE","- Afavorir la implicació de l’alumnat a partir d’una proposta didàctica dissenyada amb els criteris de significació, comunicació, acció i projecció del currículum competencial orientador.&#10;- Promoure el coneixement del patrimoni més proper al centre edu",Per formar part del programa Apadrinem els centres educatius han de presentar la sol·licitud de participació i complir els requisits següents:&#10;- Dissenyar i planificar el projecte.&#10;- Impulsar el treball en equip i en xarxa.&#10;- Procurar les garan,"La participació del centre en el programa Apadrinem suposa l’acceptació dels compromisos següents:&#10;- Designar un grup impulsor del projecte, tenint present la previsió de continuïtat al llarg del projecte.&#10;- Implicar els diferents equips del centre",Trianual,15_Apadrinem.pdf,https://clic.xtec.cat/pub/innovacio/fitxes/15_apadrinem.pdf,https://www.youtube.com/watch?v=gJeeuhZPs3M&list=PLHQ2RmbOIhEqjjKbhH-LTt_QgyUdD6IYY,https://xtec.gencat.cat/ca/projectes/apadrinemnostrepatrimoni,apadrinem.png,,,exiteducatiu.educacio@gencat.cat,,S,,1uk3rS1WUA8yPtaRL0kG1Y0p_E-93J5H0KbNaQ_MZMJs,"{""id"": ""59"", ""Bloc"": ""Programes"", ""Fitxa"": ""15_Apadrinem.pdf"", ""Enllac"": ""https://xtec.gencat.cat/ca/projectes/apadrinemnostrepatrimoni"", ""Simbol"": ""apadrinem.png"", ""Unitat"": """", ""Vídeo"": ""https://www.youtube.com/watch?v=gJeeuhZPs3M&list=PLHQ2RmbOIhEqjjKbh"
19,60,60,Programes,orientacio,Orientació educativa per a l’aprenentatge competencial orientador,"L’objecte del programa _Orientació educativa per a l’aprenentatge competencial i orientador_ és acompanyar els centres educatius en el canvi planificat: el coneixement, la implementació i la consolidació de pràctiques educatives competencials i orientadore",PSO,"A1-MET,A2-ORG,A3-COM","ESO,BATX,CFPS",La finalitat del Programa d&apos;innovació d&apos;Orientació educativa és la reflexió i l&apos;acció pedagògica dels docents per promoure l&apos;orientació educativa centrada en l&apos;aprenent.&#10;&#10;Els objectius del programa són:&#10;- Donar valor a ,"Per formar part del programa, els centres educatius han de presentar la sol·licitud de participació i complir els requisits següents:&#10;- Entregar la declaració de l&apos;aprovació per participar en el Programa per part del claustre i del consell escolar","La participació del centre en el programa suposa l’acceptació dels compromisos següents:&#10;- Implicació de l’equip docent en la participació en el programa Orientació durant 3 anys.&#10;- Participar en les activitats formatives, de coordinació i de xarxa",Anual,17_Programa orientació.pdf,https://clic.xtec.cat/pub/innovacio/fitxes/17_programa orientació.pdf,https://www.youtube.com/watch?v=Z2dOm8AnJo0&list=PLHQ2RmbOIhEqjjKbhH-LTt_QgyUdD6IYY&index=7,https://xtec.gencat.cat/ca/curriculum/orientacioeducativa/model-competencial-orientador,scap.png,,,exiteducatiu.educacio@gencat.cat,,S,S,17CUJ6oTasDG_Hf3O9b69bPk9rkDqGN4qHcZxsXcMtpY,"{""id"": ""60"", ""Bloc"": ""Programes"", ""Fitxa"": ""17_Programa orientació.pdf"", ""Enllac"": ""https://xtec.gencat.cat/ca/curriculum/orientacioeducativa/model-competencial-orientador"", ""Simbol"": ""scap.png"", ""Unitat"": """", ""Vídeo"": ""https://www.youtube.com/watch?v=Z2dO"
20,61,61,Programes,steamcat,STEAMcat,"El programa d’innovació pedagògica _STEAMcat_ consisteix en l’acompanyament dels centres mitjançant l’assessorament, la creació de la Comunitat STEAMcat, les formacions i els recursos. Aprofitant el lideratge distribuït del centre, les metodologies, perspe","MAT,CME,CIE,ART,DIG","A1-MET,A2-ORG,A3-COM","EINF2C,EPRI,ESO,EE","- Augmentar les vocacions cientificotecnològiques i matemàtiques, especialment en dones i contextos socials desafavorits.&#10;- Reforçar el procés d’orientació de l’alumnat envers els estudis i professions de l’àmbit STEM en termes d’equitat i en totes les","Per formar part del programa, els centres educatius han de complir els requisits següents:&#10;- Presentar un avantprojecte STEAMcat de centre.&#10;- Entregar el compromís de centre, que ha d’estar aprovat pel claustre i pel consell escolar.&#10;- Presenta","La participació del centre en el programa STEAMcat suposa l’acceptació dels compromisos següents:&#10;- Portar a terme un projecte de centre STEAM durant 3 anys.&#10;- Designar un nucli impulsor. A l’educació infantil i primària, ha d’estar format per una ",Trianual,18_STEAMcat.pdf,https://clic.xtec.cat/pub/innovacio/fitxes/18_steamcat.pdf,https://www.youtube.com/watch?v=2MvJqnL2U7I&list=PLHQ2RmbOIhEqjjKbhH-LTt_QgyUdD6IYY&index=9,https://projectes.xtec.cat/steamcat/,steam_cat.png,,,programasteam@xtec.cat,,S,,1HOURY16pQqtWh5RfHf3pke43XkuZCgk8WshZ6ID5cuk,"{""id"": ""61"", ""Bloc"": ""Programes"", ""Fitxa"": ""18_STEAMcat.pdf"", ""Enllac"": ""https://projectes.xtec.cat/steamcat/"", ""Simbol"": ""steam_cat.png"", ""Unitat"": """", ""Vídeo"": ""https://www.youtube.com/watch?v=2MvJqnL2U7I&list=PLHQ2RmbOIhEqjjKbhH-LTt_QgyUdD6IYY&index=9"","
21,62,62,Programes,aquiproubullying,#aquiproubullying,"El Programa _#aquíproubullying_ té com a objectiu oferir eines i recursos als centres educatius i a la comunitat educativa per actuar davant les situacions de risc d&apos;assetjament escolar, evitant o aturant possibles casos alhora que contribuint al dese","SOC,PSO,EVA,CVA","A1-MET,A2-ORG,A3-COM","EINF2C,EPRI,ESO","- Sensibilitzar la comunitat escolar de la importància de prevenir i erradicar l’assetjament entre iguals.&#10;- Formar la comunitat escolar per tal de prevenir, detectar i intervenir davant possibles situacions d’assetjament entre iguals.&#10;- Apoderar i","Poden formar part del programa #aquiproubullying els centres educatius que reuneixin els requisits següents, d’acord amb la Resolució EDU/2608/2019​.&#10;- Impartir ensenyaments obligatoris:&#10;- Acceptar els compromisos dels centres participants del punt","- Constituir un equip de referència, format com a mínim per un membre de l’equip directiu, dos docents, un professional no docent del centre, un membre de l’AMPA i, en el cas de secundària, tres alumnes del centre de 3r o 4t d’ESO (que han de tenir l’autor",Trianual,01_#aquíproubullying.pdf,https://clic.xtec.cat/pub/innovacio/fitxes/01_#aquíproubullying.pdf,https://www.youtube.com/watch?v=dOP7NraKp-Q&list=PLHQ2RmbOIhEqjjKbhH-LTt_QgyUdD6IYY&index=2,http://xtec.gencat.cat/ca/centres/projeducatiu/convivencia/aquiproubullying/,bullying.png,,,eif.ensenyament@gencat.cat,,S,,1Gi9XMOZHrWO5vsBTgHJyxMJMr_2P-Kge3kUPproCn0M,"{""id"": ""62"", ""Bloc"": ""Programes"", ""Fitxa"": ""01_#aquíproubullying.pdf"", ""Enllac"": ""http://xtec.gencat.cat/ca/centres/projeducatiu/convivencia/aquiproubullying/"", ""Simbol"": ""bullying.png"", ""Unitat"": """", ""Vídeo"": ""https://www.youtube.com/watch?v=dOP7NraKp-Q&"
22,63,63,Programes,activafp,Programa Activa FP,"El programa _ActivaFP_ consisteix en la promoció de metodologies competencials basades en l'aprenentatge col·laboratiu, a més, proposa reptes i projectes relacionats amb situacions o entorns laborals. Integra activitats específiques de formació del profess",,"A1-MET,A2-ORG,A3-COM","CFPM,CFPS","**1. En relació amb l’alumnat:**
 - Promoure la formació i la qualificació de l’alumnat mitjançant l’aplicació de metodologies d’aprenentatge competencial basades en el treball per reptes i projectes vinculats a situacions iguals o properes a l’entorn de ","Per formar part del programa els centres educatius han de presentar la sol·licitud de participació i complir els requisits següents:
- Impartir ensenyaments de formació professional, d’arts plàstiques i disseny o esportius de règim especial. 
- Tenir imp","La participació del centre en el programa suposa l’acceptació dels compromisos següents: 
- Incorporar en el Projecte educatiu del centre els objectius i les estratègies metodològics derivats del programa ActivaFP, i garantir-ne el desplegament en els ens",Anual,02_ActivaFP.pdf,https://clic.xtec.cat/pub/innovacio/fitxes/02_activafp.pdf,,https://projectes.xtec.cat/impulsfp/categoria/impulsfp/activafp/experiencies_activafp/,activafp.png,Innovació,Pedro Caro,pedrocaro@gencat.cat ,,S,S,1pfpbaeTjWuzTw4vBVKeM59uSYpCEc4H7RXvrVbw9rWw,"{""id"": ""63"", ""Bloc"": ""Programes"", ""Fitxa"": ""02_ActivaFP.pdf"", ""Enllac"": ""https://projectes.xtec.cat/impulsfp/categoria/impulsfp/activafp/experiencies_activafp/"", ""Simbol"": ""activafp.png"", ""Unitat"": """", ""Vídeo"": """", ""Centres"": ""63"", ""Periode"": ""Anual"", ""Con"
23,64,64,Programes,mobils.edu,Mòbils.edu,"El Programa _Mòbils.edu_ és un pla digital que té com a finalitat l’impuls de la tecnologia digital en els centres i, especialment, els dispositius mòbils, com a eina educativa estratègica per al desenvolupament curricular, el treball competencial, l’educa","ART,CIE,DIG,LIN,MAT,SOC,PSO,EVA,CME,CVA,EFI","A1-MET,A2-ORG,A3-COM","EPRI,ESO,EE",- Acompanyar els centres i la comunitat educativa en el procés de transformació educativa.&#10;- Millorar la competència digital dels alumnes afavorint l’aprenentatge de les altres competències.&#10;- Posar en valor el paper inclusiu de la tecnologia per a,"Els destinataris del Programa mòbils.edu són els centres educatius que imparteixen ensenyaments d&apos;educació infantil, primària i secundària obligatòria del Servei d&apos;Educació de Catalunya que compleixin els requisits següents:&#10;- Impartir un d&a",La participació del centre en el programa mòbils.edu implica l&apos;acceptació dels compromisos següents:&#10;- Implementació del projecte vinculat al programa d&apos;innovació pedagògica mòbils.edu en el centre&#10;- Designació d&apos;un grup impulsor del,Trianual,BAIXA,https://clic.xtec.cat/pub/innovacio/fitxes/baixa,https://www.youtube.com/watch?v=2vTamla7i60,https://agora.xtec.cat/mobilsedu/,generic.png,,,mobilsedu@xtec.cat,,S,,1RNaJciT6SeAAeC_EOzUaX-bS_A5O-VF6-UMqpeRUcuU,"{""id"": ""64"", ""Bloc"": ""Programes"", ""Fitxa"": ""BAIXA"", ""Enllac"": ""https://agora.xtec.cat/mobilsedu/"", ""Simbol"": ""generic.png"", ""Unitat"": """", ""Vídeo"": ""https://www.youtube.com/watch?v=2vTamla7i60"", ""Centres"": ""64"", ""Periode"": ""Trianual"", ""Contacte"": ""mobilsedu"
24,65,65,Programes,AraArt,araArt,"El Departament d’Educació crea el Programa d'innovació pedagògica “araArt” amb la finalitat de fomentar i posar en valor projectes artístics que es porten a terme en el si d'un centre d'educació infantil, primària o secundària, en col·laboració amb una esc","ART,CIE,CME,CVA,DIG,EFI,EVA,LIN,MAT,PSO,SOC","A1-MET,A3-COM","BATX,EE,EINF2C,EPRI,ESO","- Potenciar les arts per millorar les capacitats i les competències bàsiques de l'alumnat d'educació infantil, primària i secundària, i contribuir a estructurar el seu pensament.
- Generar situacions d'aprenentatge vinculades a les arts que afavoreixin l'","Per formar part del Programa els centres educatius han de presentar la sol·licitud de participació i complir els requisits següents:
- Presentar la sol·licitud dins del termini previst. Model disponible al portal de centre.
- Presentar el projecte dissen","La participació del centre en el Programa suposa l'acceptació dels compromisos següents:
- La designació d'un grup impulsor del projecte. El grup impulsor, s'ha de designar tenint present la previsió de continuïtat al llarg del projecte.
- La implicació ",Trianual,araArt.pdf,https://clic.xtec.cat/pub/innovacio/fitxes/araart.pdf,,https://xtec.gencat.cat/ca/innovacio/programes_innovacio/formacio-professional-i-regim-especial/araart/,araart.png,Innovació,Elisenda Poch,epoch2@xtec.cat,,S,,13eJ1Khy32nTZbDj_BZI8FzwxAAcFwGGHZPQoPaKOTUo,"{""id"": ""65"", ""Bloc"": ""Programes"", ""Fitxa"": ""araArt.pdf"", ""Enllac"": ""https://xtec.gencat.cat/ca/innovacio/programes_innovacio/formacio-professional-i-regim-especial/araart/"", ""Simbol"": ""araart.png"", ""Unitat"": """", ""Vídeo"": """", ""Centres"": ""65"", ""Periode"": ""Tr"
25,66,66,Programes,Art de Parlar,L'art de parlar,El programa _L’art de parlar_ consisteix en reforçar la competència oral dels alumnes dels ensenyaments de llengua a l’educació d’adults en el marc de la competència global implementant les estratègies de pensament visual aplicades a les obres d’art amb un,"ART, LIN, SOC, PSO, EVA, CME, CVA","A1-MET,A2-ORG,A3-COM",ADULTS,- Millorar la competència comunicativa de l’alumnat a través d’un ensenyament de les llengües basat en les estratègies de pensament visual a través de les obres d’art.&#10;- Ajudar els participants a aplicar amb èxit la competència global en la vida quotid,"Per formar part del Programa els centres educatius han de presentar la sol·licitud de participació i complir els requisits següents:&#10;- Presentar l’avantprojecte dissenyat i planificat, d’acord amb el criteris que s’estableixen a l’ annex 3.&#10;- Impul","La participació del centre en el Programa suposa l&apos;acceptació dels compromisos següents:&#10;- Implementació del projecte vinculat al programa L’art de parlar en el centre.&#10;- La designació d’un grup impulsor del projecte. El grup impulsor, s’ha de",Trianual,BAIXA,https://clic.xtec.cat/pub/innovacio/fitxes/baixa,,https://projectes.xtec.cat/xarxadults/programes/lart-de-parlar/,artparlar.png,,,,,S,,1hrrVzNQ1JCvdqhJKE9sDEXRT9xRFbjUMYrDIqGzFI-s,"{""id"": ""66"", ""Bloc"": ""Programes"", ""Fitxa"": ""BAIXA"", ""Enllac"": ""https://projectes.xtec.cat/xarxadults/programes/lart-de-parlar/"", ""Simbol"": ""artparlar.png"", ""Unitat"": """", ""Vídeo"": """", ""Centres"": ""66"", ""Periode"": ""Trianual"", ""Contacte"": """", ""Nom_curt"": ""Art "
26,67,67,Programes,PEE 0-20,Plans educatius d'entorn 0-20,"El Programa _Plans educatius d’entorn 0-20_ vol promoure la implicació dels centres educatius en el pilotatge dels plans educatius d’entorn 0-20.  &#10;Els centres educatius, referents i responsables de l’educació formal, tenen un paper clau com a punt d’a","ART, CIE, DIG, LIN, MAT, SOC, PSO, EVA, CME, CVA, EFI","A1-MET,A3-COM","EINF2C,EPRI,ESO,BATX,CFPM,CFPS,EE","- Generar un contínuum educatiu (formal i no formal) que incrementi les possibilitats d’èxit acadèmic, personal i relacional de l’alumnat.&#10;- Orientar i acompanyar l’alumnat i les seves famílies dels 0 als 20 anys, especialment en la transició d’etapes ",Per formar part del Programa PEE 0-20 els centres educatius han de presentar la sol·licitud de participació en el termini establert i complir els requisits següents:&#10;- Acceptar els compromisos del punt 2.2 de la Resolució&#10;- Estar relacionat en l’an,"La participació del centre en el Programa PEE 0-20 suposa l&apos;acceptació dels compromisos següents:&#10;- Constituir un equip impulsor format com a mínim per un membre de l’equip directiu, un docent, un professional no docent del centre, un membre de l’",Trianual,BAIXA,https://clic.xtec.cat/pub/innovacio/fitxes/baixa,,https://sites.google.com/a/xtec.cat/servei-comunitari/benvinguda?authuser=0,pee.png,,,pee.educacio@gencat.cat,,S,,1XoqSfrUdZIe04fdDAdmJ1HdOWwNtS9ybzgnWwgiyZpw,"{""id"": ""67"", ""Bloc"": ""Programes"", ""Fitxa"": ""BAIXA"", ""Enllac"": ""https://sites.google.com/a/xtec.cat/servei-comunitari/benvinguda?authuser=0"", ""Simbol"": ""pee.png"", ""Unitat"": """", ""Vídeo"": """", ""Centres"": ""67"", ""Periode"": ""Trianual"", ""Contacte"": ""pee.educacio@g"
27,68,68,Programes,EmpresaFP,Programa EmpresaFP,"El programa EmpresaFP dona suport als centres que imparteixen ensenyaments professionals a desplegar estratègies adreçades a reforçar la seva relació amb les empreses mitjançant l’intercanvi de serveis complementaris, i desenvolupar projectes conjunts cent",,"A1-MET,A3-COM","CFAS,CFPM,CFPS","EmpresaFP és un programa adreçat a tots aquells instituts de formació professional que vulguin millorar la seua competitivitat través del serveis que poden prestar a empreses.

El programa promou difondre del catàleg de serveis dels centres per establir ","- Impartir ensenyaments professionals sostinguts amb fons públics.
-Tenir implantat un sistema de gestió de qualitat i millora del centre o estar en procés d'assolir-lo.","La selecció del centre suposa l'acceptació dels compromisos següents:
- Designar una persona coordinadora del projecte en el centre. En el cas dels centres públics la persona coordinadora del projecte ha de ser designada, preferentment, entre el professor",Anual,68_empresafp.pdf,https://clic.xtec.cat/pub/innovacio/fitxes/68_empresafp.pdf,,https://projectes.xtec.cat/empresafp/,assessorament_fp.png,,,,,S,S,1gi_w5l1hQI026Kdp4nNL4H_KUgx4I_Lqek5DmOFVcVo,"{""id"": ""68"", ""Bloc"": ""Programes"", ""Fitxa"": ""68_empresafp.pdf"", ""Enllac"": ""https://projectes.xtec.cat/empresafp/"", ""Simbol"": ""assessorament_fp.png"", ""Unitat"": """", ""Vídeo"": """", ""Centres"": ""68"", ""Periode"": ""Anual"", ""Contacte"": """", ""Nom_curt"": ""EmpresaFP"", ""Ob"
28,69,69,Programes,OrientaFP,Programa OrientaFP,"El programa acompanya i dona suport als centres que imparteixen ensenyaments professionals en la implementació, el desenvolupament i la millora d'estratègies, mesures i plans per a l'orientació acadèmica i professional de l'alumnat, proporcionant eines, re",,"A1-MET,A3-COM","CFAS,CFPM,CFPS",,,,Anual,69_orientafp.pdf,https://clic.xtec.cat/pub/innovacio/fitxes/69_orientafp.pdf,,https://projectes.xtec.cat/impulsfp/categoria/impulsfp/orientafp/,orientafp.png,,,,,S,S,1mlT1m-OlUZ4-b-YQlxcN-mevTUmG3nMRIeJsm8vUxAc,"{""id"": ""69"", ""Bloc"": ""Programes"", ""Fitxa"": ""69_orientafp.pdf"", ""Enllac"": ""https://projectes.xtec.cat/impulsfp/categoria/impulsfp/orientafp/"", ""Simbol"": ""orientafp.png"", ""Unitat"": """", ""Vídeo"": """", ""Centres"": ""69"", ""Periode"": ""Anual"", ""Contacte"": """", ""Nom_cu"
29,70,70,Programes,MUFPS,"Pràctiques en centres educatius del màster universitari de formació del professorat d’ESO, Batxillerat, FP i Idiomes","El _Programa d’Innovació Pedagògica de Pràctiques del Màster Universitari de Formació del Professorat d’Educació Secundària Obligatòria i Batxillerat, Formació Professional i Ensenyaments d’Idiomes en Centres Educatius_ consisteix en aprofundir en la quali","ART,CIE,DIG,LIN,MAT,SOC,PSO,EVA,CME,CVA,EFI","A1-MET,A2-ORG,A3-COM","ESO,BATX,CFPM,CFPS",- Assignar valor als centres formadors com a institucions clau en la formació inicial de la funció docent.&#10;- Professionalitzar i reconèixer la tasca d’acompanyament dels mentors de centre i dels tutors de les universitats.&#10;- Incorporar l’estudiant ,"Per formar part del Programa els centres educatius han de presentar la sol·licitud de participació i complir els requisits següents:&#10;- Presentar l’avantprojecte de centre&#10;- Aportar el compromís del centre, amb l’aprovació del Claustre i del Consell",Compromisos dels centres participants:&#10;- La participació del centre en el Programa suposa l&apos;acceptació dels compromisos següents:&#10;- Portar a terme un projecte de Pràctiques en centre durant 3 anys.&#10;- La designació d’un membre de l’equip di,Trianual,,,,https://projectes.xtec.cat/centresformadors/justificacio-del-programa/,mufps.png,,,centresformadors.educacio@gencat.cat,,S,,1D3OzXHISrldOAF1-lYL3cVp4OkoceR4X3uA5C70xt7E,"{""id"": ""70"", ""Bloc"": ""Programes"", ""Fitxa"": """", ""Enllac"": ""https://projectes.xtec.cat/centresformadors/justificacio-del-programa/"", ""Simbol"": ""mufps.png"", ""Unitat"": """", ""Vídeo"": """", ""Centres"": ""70"", ""Periode"": ""Trianual"", ""Contacte"": ""centresformadors.educa"
